company_name,URL1,URL2,URL3
U.S. National Guard,http://www.nationalguard.mil/,https://www.nationalguard.mil/,https://en.wikipedia.org/wiki/National_Guard_(United_States)
U.S. Navy,https://www.navy.mil/,https://www.navy.mil/Resources/Photo-Gallery/,https://www.navy.mil/Resources/Contact-Us/
U.S. NIST (National Institute of Standards and Technology),https://www.nist.gov/,https://www.nist.gov/about-nist,https://webbook.nist.gov/chemistry/
U.S. NPSTC (National Public Safety Telecommunications Council),https://www.npstc.org/,https://www.npstc.org/calendar.jsp,https://www.npstc.org/npstcReports.jsp
U.S. NREL (National Renewable Energy Laboratory),https://www.nrel.gov/,https://www.nrel.gov/research/data-tools.html,https://www.nrel.gov/careers/
U.S. NSA (National Security Agency),https://www.nsa.gov/,https://www.nsa.gov/careers/,https://www.nsa.gov/Helpful-Links/Contact-NSA/
U.S. NSF (National Science Foundation),https://www.nsf.gov/,https://new.nsf.gov/funding,https://new.nsf.gov/about
U.S. NTIA (National Telecommunications and Information Administration),https://www.ntia.gov/,https://www.ntia.gov/page/about-ntia,https://www.ntia.gov/category/funding-programs
U.S. Space Force,https://www.spaceforce.mil/,https://www.spaceforce.mil/About-Us/About-Space-Force/,https://www.spaceforce.mil/About-Us/Space-Force-Locations/
U.S. VA (Department of Veterans Affairs),https://www.va.gov/,https://www.benefits.va.gov/,https://www.va.gov/contact-us/
